<?xml version="1.0" encoding="UTF-8"?>
<xsd:schema xmlns:xsd="http://www.w3.org/2001/XMLSchema" xmlns:od="urn:schemas-microsoft-com:officedata">
<xsd:element name="dataroot">
<xsd:complexType>
<xsd:sequence>
<xsd:element ref="battle_cities" minOccurs="0" maxOccurs="unbounded"/>
</xsd:sequence>
<xsd:attribute name="generated" type="xsd:dateTime"/>
</xsd:complexType>
</xsd:element>
<xsd:element name="battle_cities">
<xsd:annotation>
<xsd:appinfo/>
</xsd:annotation>
<xsd:complexType>
<xsd:sequence>
<xsd:element name="city" minOccurs="1" od:jetType="text" od:sqlSType="nvarchar" od:nonNullable="yes">
<xsd:simpleType>
<xsd:restriction base="xsd:string">
<xsd:maxLength value="50"/>
</xsd:restriction>
</xsd:simpleType>
</xsd:element>
<xsd:element name="minimum_building_scale" minOccurs="1" od:jetType="decimal" od:sqlSType="decimal" od:nonNullable="yes">
<xsd:simpleType>
<xsd:restriction base="xsd:decimal">
<xsd:totalDigits value="18"/>
<xsd:fractionDigits value="4"/>
</xsd:restriction>
</xsd:simpleType>
</xsd:element>
<xsd:element name="maximum_building_scale" minOccurs="1" od:jetType="decimal" od:sqlSType="decimal" od:nonNullable="yes">
<xsd:simpleType>
<xsd:restriction base="xsd:decimal">
<xsd:totalDigits value="18"/>
<xsd:fractionDigits value="4"/>
</xsd:restriction>
</xsd:simpleType>
</xsd:element>
<xsd:element name="town_min_distance" minOccurs="1" od:jetType="longinteger" od:sqlSType="int" od:nonNullable="yes" type="xsd:int"/>
<xsd:element name="city_min_distance" minOccurs="1" od:jetType="longinteger" od:sqlSType="int" od:nonNullable="yes" type="xsd:int"/>
<xsd:element name="town_radius" minOccurs="1" od:jetType="longinteger" od:sqlSType="int" od:nonNullable="yes" type="xsd:int"/>
<xsd:element name="city_radius" minOccurs="1" od:jetType="longinteger" od:sqlSType="int" od:nonNullable="yes" type="xsd:int"/>
<xsd:element name="number_of_town_buildings" minOccurs="1" od:jetType="longinteger" od:sqlSType="int" od:nonNullable="yes" type="xsd:int"/>
<xsd:element name="number_of_city_buildings" minOccurs="1" od:jetType="longinteger" od:sqlSType="int" od:nonNullable="yes" type="xsd:int"/>
<xsd:element name="s_ColLineage" minOccurs="0" od:jetType="oleobject" od:sqlSType="image">
<xsd:simpleType>
<xsd:restriction base="xsd:base64Binary">
<xsd:maxLength value="1476395008"/>
</xsd:restriction>
</xsd:simpleType>
</xsd:element>
<xsd:element name="s_Generation" minOccurs="0" od:jetType="longinteger" od:sqlSType="int" type="xsd:int"/>
<xsd:element name="s_GUID" minOccurs="0" od:jetType="replicationid" od:sqlSType="uniqueidentifier" od:autoUnique="yes">
<xsd:simpleType>
<xsd:restriction base="xsd:string">
<xsd:maxLength value="38"/>
</xsd:restriction>
</xsd:simpleType>
</xsd:element>
<xsd:element name="s_Lineage" minOccurs="0" od:jetType="oleobject" od:sqlSType="image">
<xsd:simpleType>
<xsd:restriction base="xsd:base64Binary">
<xsd:maxLength value="1476395008"/>
</xsd:restriction>
</xsd:simpleType>
</xsd:element>
</xsd:sequence>
</xsd:complexType>
</xsd:element>
</xsd:schema>
