<?xml version="1.0" encoding="UTF-8"?>
<dataroot xmlns:od="urn:schemas-microsoft-com:officedata" xmlns:xsi="http://www.w3.org/2001/XMLSchema-instance"  xsi:noNamespaceSchemaLocation="battle_cities.xsd" generated="2009-07-13T15:08:52">
<battle_cities>
<city>American</city>
<minimum_building_scale>0.75</minimum_building_scale>
<maximum_building_scale>1.25</maximum_building_scale>
<town_min_distance>2100</town_min_distance>
<city_min_distance>3000</city_min_distance>
<town_radius>500</town_radius>
<city_radius>1000</city_radius>
<number_of_town_buildings>400</number_of_town_buildings>
<number_of_city_buildings>900</number_of_city_buildings>
<s_ColLineage>NAnHjgIAAAA0CceOAQAAADQJx44DAAAANAnHjgMAAAA0CceOAwAAADQJx44GAAAA
NAnHjgMAAAA0CceOCgAAADQJx44IAAAANAnHjgkAAAA=
</s_ColLineage>
<s_Generation>0</s_Generation>
<s_GUID>{0F30A6A8-9594-481F-9E11-D9C5C99BB1CC}</s_GUID>
<s_Lineage>NAnHjgoAAAAAAAAAAAAAAA==
</s_Lineage>
</battle_cities>
<battle_cities>
<city>Eastern</city>
<minimum_building_scale>0.75</minimum_building_scale>
<maximum_building_scale>1.25</maximum_building_scale>
<town_min_distance>2100</town_min_distance>
<city_min_distance>3000</city_min_distance>
<town_radius>500</town_radius>
<city_radius>1000</city_radius>
<number_of_town_buildings>400</number_of_town_buildings>
<number_of_city_buildings>900</number_of_city_buildings>
<s_ColLineage>NAnHjgIAAAA0CceOAQAAADQJx44DAAAANAnHjgQAAAA0CceOBQAAADQJx44LAAAA
NAnHjgcAAAA0CceODwAAADQJx44NAAAANAnHjg4AAAA=
</s_ColLineage>
<s_Generation>0</s_Generation>
<s_GUID>{AAACD1AE-8AF1-4B5B-A4B4-39C19EF4B87F}</s_GUID>
<s_Lineage>NAnHjg8AAAAAAAAAAAAAAA==
</s_Lineage>
</battle_cities>
<battle_cities>
<city>European</city>
<minimum_building_scale>0.75</minimum_building_scale>
<maximum_building_scale>1.25</maximum_building_scale>
<town_min_distance>2100</town_min_distance>
<city_min_distance>3000</city_min_distance>
<town_radius>500</town_radius>
<city_radius>1000</city_radius>
<number_of_town_buildings>400</number_of_town_buildings>
<number_of_city_buildings>900</number_of_city_buildings>
<s_ColLineage>NAnHjgIAAAA0CceOAgAAADQJx44DAAAANAnHjgQAAAA0CceOBQAAADQJx44LAAAA
NAnHjgcAAAA0CceODwAAADQJx44NAAAANAnHjg4AAAA=
</s_ColLineage>
<s_Generation>0</s_Generation>
<s_GUID>{90FBFA7E-0D86-4ECE-9337-B55E79EFB624}</s_GUID>
<s_Lineage>NAnHjg8AAAAAAAAAAAAAAA==
</s_Lineage>
</battle_cities>
<battle_cities>
<city>Native</city>
<minimum_building_scale>0.75</minimum_building_scale>
<maximum_building_scale>0.9</maximum_building_scale>
<town_min_distance>2000</town_min_distance>
<city_min_distance>2000</city_min_distance>
<town_radius>600</town_radius>
<city_radius>600</city_radius>
<number_of_town_buildings>15</number_of_town_buildings>
<number_of_city_buildings>15</number_of_city_buildings>
<s_ColLineage>NAnHjgIAAAA0CceOAQAAADQJx44RAAAANAnHjhEAAAA0CceOCwAAADQJx44LAAAA
NAnHjg0AAAA0CceODAAAADQJx44PAAAANAnHjg8AAAA=
</s_ColLineage>
<s_Generation>0</s_Generation>
<s_GUID>{4C90716E-DE37-4679-B459-9FB080397EB8}</s_GUID>
<s_Lineage>NAnHjhEAAAAAAAAAAAAAAA==
</s_Lineage>
</battle_cities>
</dataroot>
